{
  "$schema": "./schemas/firefox-retirement-exact-schema-containment-proof-v1.schema.json",
  "kind": "firefox-retirement-exact-schema-containment-proof",
  "contract_version": 1,
  "proof_id": "bpm095-esr140.13-to-esr153.0-identity-containment-v1",
  "evidence_scope": "production-exact-artifacts",
  "source": {
    "line_id": "esr-140",
    "artifact_id": "esr-140.13",
    "schema_bundle_sha256": "9dd77157022cf463b2c0cce2a168527b2809e9647ada369583b9e459732c26d4",
    "validation_schema_sha256": "930803d175d7f4942d7101812a9cece1325026d0787760676c8dda8ada07f6cd"
  },
  "target": {
    "line_id": "esr-153",
    "artifact_id": "esr-153.0",
    "schema_bundle_sha256": "afd71b67bd0483756803ad8b03f3571507f3cee69160142f8fff12cabde00d80",
    "validation_schema_sha256": "bcdf1f2cd349f81c1bc8b1e1bffda69422d88e95c2203e8957987825486a42a2"
  },
  "successor_line_id": "esr-153",
  "method": "schema-containment",
  "recipe_registry": {
    "registry_id": "firefox-profile-conversion",
    "registry_version": 1,
    "recipes": [],
    "registry_digest": "1d4b572f358a7ff9f7e23beb5a2a27104cec4c2d3451ad8a49099cf8665113a6"
  },
  "semantic_attestation": {
    "attestation_id": "bpm095-esr140.13-to-esr153.0-semantic-identity-v1",
    "identity_transform": "every source-valid policy document is retained byte-for-byte; no default is materialized and no target-only field is added",
    "source_policy_ids": [
      "3rdparty", "AllowFileSelectionDialogs", "AllowedDomainsForApps", "AppAutoUpdate", "AppUpdatePin", "AppUpdateURL", "Authentication", "AutoLaunchProtocolsFromOrigins", "AutofillAddressEnabled", "AutofillCreditCardEnabled", "BackgroundAppUpdate", "BlockAboutAddons", "BlockAboutConfig", "BlockAboutProfiles", "BlockAboutSupport", "Bookmarks", "CaptivePortal", "Certificates", "Containers", "ContentAnalysis", "Cookies", "DNSOverHTTPS", "DefaultDownloadDirectory", "DefaultSerialGuardSetting", "DisableAppUpdate", "DisableBuiltinPDFViewer", "DisableDefaultBrowserAgent", "DisableDeveloperTools", "DisableEncryptedClientHello", "DisableFeedbackCommands", "DisableFirefoxAccounts", "DisableFirefoxScreenshots", "DisableFirefoxStudies", "DisableForgetButton", "DisableFormHistory", "DisableMasterPasswordCreation", "DisablePasswordReveal", "DisablePocket", "DisablePrivateBrowsing", "DisableProfileImport", "DisableProfileRefresh", "DisableSafeMode", "DisableSecurityBypass", "DisableSetDesktopBackground", "DisableSystemAddonUpdate", "DisableTelemetry", "DisableThirdPartyModuleBlocking", "DisabledCiphers", "DisplayBookmarksToolbar", "DisplayMenuBar", "DontCheckDefaultBrowser", "DownloadDirectory", "EnableTrackingProtection", "EncryptedMediaExtensions", "EnterprisePoliciesEnabled", "ExemptDomainFileTypePairsFromFileTypeDownloadWarnings", "ExtensionSettings", "ExtensionUpdate", "Extensions", "FirefoxHome", "FirefoxSuggest", "GoToIntranetSiteForSingleWordEntryInAddressBar", "Handlers", "HardwareAcceleration", "Homepage", "HttpAllowlist", "HttpsOnlyMode", "InstallAddonsPermission", "LegacyProfiles", "LegacySameSiteCookieBehaviorEnabled", "LegacySameSiteCookieBehaviorEnabledForDomainList", "LocalFileLinks", "ManagedBookmarks", "ManualAppUpdateOnly", "MicrosoftEntraSSO", "NetworkPrediction", "NewTabPage", "NoDefaultBookmarks", "OfferToSaveLogins", "OfferToSaveLoginsDefault", "OverrideFirstRunPage", "OverridePostUpdatePage", "PDFjs", "PasswordManagerEnabled", "PasswordManagerExceptions", "Permissions", "PictureInPicture", "PopupBlocking", "PostQuantumKeyAgreementEnabled", "Preferences", "PrimaryPassword", "PrintingEnabled", "PrivateBrowsingModeAvailability", "PromptForDownloadLocation", "Proxy", "RequestedLocales", "SSLVersionMax", "SSLVersionMin", "SanitizeOnShutdown", "SearchBar", "SearchEngines", "SearchSuggestEnabled", "SecurityDevices", "ShowHomeButton", "SkipTermsOfUse", "StartDownloadsInTempDirectory", "SupportMenu", "TranslateEnabled", "UseSystemPrintDialog", "UserMessaging", "WebsiteFilter", "WindowsSSO"
    ],
    "source_policy_ids_sha256": "76fbd36c9bdcba8a96937adfc020161a2687952ef6d886be3158a494726201c4",
    "reviewed_upstream_documents": [
      {
        "source_tag": "mozilla-policy-templates-v7.12",
        "path": "data/upstream/policy-templates/v7.12/policy-templates.md",
        "sha256": "cebeacfdff92699c53d1fa7ab3b9db76fb2dae4362e3dd929165be1da79e265b"
      },
      {
        "source_tag": "mozilla-policy-templates-v8.0",
        "path": "data/upstream/policy-templates/v8.0/policy-templates.md",
        "sha256": "2e00f3bf14ce2e90b96d9697700c493cc3688fb95aed2af49a000a5b62ef0bc1"
      }
    ],
    "review_findings": [
      {
        "source_schema_pointer": "/properties/Cookies",
        "finding": "ESR153 preserves each ESR140 Cookies value and adds only partition-foreign to Behavior and BehaviorPrivateBrowsing enums."
      },
      {
        "source_schema_pointer": "/properties/ExtensionSettings",
        "finding": "ESR153 preserves the ESR140 per-extension object and adds optional allowed_permissions, blocked_permissions, runtime_allowed_hosts, and runtime_blocked_hosts."
      },
      {
        "source_schema_pointer": "/properties/Homepage",
        "finding": "ESR153 preserves the ESR140 Homepage object and adds optional NewTabOnRestore."
      }
    ],
    "semantic_conclusion": "The exact source policy identifiers and every source-valid value shape retain their documented Firefox enterprise-policy interpretation on ESR153. The three validation differences are target-only acceptance expansions; no source-valid setting is remapped, removed, narrowed, or assigned a new default."
  },
  "containment_evidence": [
    {
      "evidence_id": "bpm095-esr140.13-to-esr153.0-root-semantic-containment-v1",
      "evidence_digest": "8ed47b736047a108052a5e9099b2e6099f615b9aec27b64aeb5d70ab50596a47",
      "source_schema_pointer": "",
      "target_schema_pointer": ""
    }
  ],
  "proof_artifact_digest": "3d04890c00a89534526fea7456e89250c36ba3617fa0d10949c8e51d98bcc2bb"
}
